{"entries":[{"actual":"int main() {\nreturn 0;\n}\n","expected":"int main() {\nreturn 0;\n}\n","input":"  int main() {  \n\n return 0; \n}\n","name":"удаляет пустые строки и обрезает края","note":"","status":"pass","suite":"Preprocessor"},{"actual":"[TokenInt,TokenIdentifier \"x\",TokenSemicolon,TokenVoid,TokenIdentifier \"f\",TokenLeftParen,TokenRightParen,TokenLeftBrace,TokenRightBrace]","expected":"[TokenInt,TokenIdentifier \"x\",TokenSemicolon,TokenVoid,TokenIdentifier \"f\",TokenLeftParen,TokenRightParen,TokenLeftBrace,TokenRightBrace]","input":"int x; void f() {}\n","name":"lexer silentLogger ≡ lexerPure","note":"","status":"pass","suite":"Lexer"},{"actual":"[TokenInt,TokenIdentifier \"main\",TokenLeftParen,TokenRightParen,TokenLeftBrace,TokenReturn,TokenNumber 0,TokenSemicolon,TokenRightBrace]","expected":"[TokenInt,TokenIdentifier \"main\",TokenLeftParen,TokenRightParen,TokenLeftBrace,TokenReturn,TokenNumber 0,TokenSemicolon,TokenRightBrace]","input":"int main() { return 0; }","name":"токенизирует базовую функцию main","note":"","status":"pass","suite":"Lexer"},{"actual":"[TokenIdentifier \"a\",TokenEqual,TokenIdentifier \"b\",TokenSemicolon,TokenIdentifier \"a\",TokenBangEqual,TokenIdentifier \"b\",TokenSemicolon,TokenIdentifier \"a\",TokenPlusAssign,TokenNumber 1,TokenSemicolon,TokenIdentifier \"a\",TokenMinusAssign,TokenNumber 2,TokenSemicolon,TokenIdentifier \"a\",TokenPlus,TokenIdentifier \"b\",TokenMinus,TokenIdentifier \"c\",TokenMultiply,TokenIdentifier \"d\",TokenSemicolon]","expected":"[TokenIdentifier \"a\",TokenEqual,TokenIdentifier \"b\",TokenSemicolon,TokenIdentifier \"a\",TokenBangEqual,TokenIdentifier \"b\",TokenSemicolon,TokenIdentifier \"a\",TokenPlusAssign,TokenNumber 1,TokenSemicolon,TokenIdentifier \"a\",TokenMinusAssign,TokenNumber 2,TokenSemicolon,TokenIdentifier \"a\",TokenPlus,TokenIdentifier \"b\",TokenMinus,TokenIdentifier \"c\",TokenMultiply,TokenIdentifier \"d\",TokenSemicolon]","input":"a==b; a!=b; a+=1; a-=2; a+b-c*d;","name":"токенизирует базовые операторы","note":"","status":"pass","suite":"Lexer"},{"actual":"[TokenIdentifier \"a\"]","expected":"[TokenIdentifier \"a\"]","input":"a","name":"разбирает один идентификатор","note":"","status":"pass","suite":"Lexer"},{"actual":"[TokenNumber 42]","expected":"[TokenNumber 42]","input":"42","name":"разбирает одно число","note":"","status":"pass","suite":"Lexer"},{"actual":"[TokenNumber 0,TokenNumber 63,TokenNumber 31,TokenNumber 42]","expected":"[TokenNumber 0,TokenNumber 63,TokenNumber 31,TokenNumber 42]","input":"0 077 0x1f 0X2A","name":"разбирает 0x и 0-формы чисел","note":"","status":"pass","suite":"Lexer"},{"actual":"[TokenNumber 8]","expected":"[TokenNumber 8]","input":"010","name":"разбирает 010 как восьмеричное 8","note":"","status":"pass","suite":"Lexer"},{"actual":"[TokenLexError \"Invalid octal literal: 08\"]","expected":"[TokenLexError \"Invalid octal literal: 08\"]","input":"08","name":"ошибка: восьмеричное 08","note":"","status":"pass","suite":"Lexer"},{"actual":"[TokenLexError \"Invalid hexadecimal literal: 0x\"]","expected":"[TokenLexError \"Invalid hexadecimal literal: 0x\"]","input":"0x","name":"ошибка: пустой hex 0x","note":"","status":"pass","suite":"Lexer"},{"actual":"[TokenNumberWithSuffix 10 SufU,TokenNumberWithSuffix 10 SufL,TokenNumberWithSuffix 10 SufUL,TokenNumberWithSuffix 255 SufU,TokenNumberWithSuffix 63 SufL]","expected":"[TokenNumberWithSuffix 10 SufU,TokenNumberWithSuffix 10 SufL,TokenNumberWithSuffix 10 SufUL,TokenNumberWithSuffix 255 SufU,TokenNumberWithSuffix 63 SufL]","input":"10U 10l 10UL 0xFFu 077L","name":"суффиксы U/L/UL","note":"","status":"pass","suite":"Lexer"},{"actual":"[TokenNumber 0,TokenNumber 0,TokenNumber 61,TokenLexError \"Invalid octal literal: 09\",TokenNumber 31,TokenNumber 31,TokenNumberWithSuffix 123 SufU,TokenNumberWithSuffix 63 SufL]","expected":"[TokenNumber 0,TokenNumber 0,TokenNumber 61,TokenLexError \"Invalid octal literal: 09\",TokenNumber 31,TokenNumber 31,TokenNumberWithSuffix 123 SufU,TokenNumberWithSuffix 63 SufL]","input":"0 00 075 09 0x1F 0X1f 123u 077L","name":"согласованный набор числовых литералов","note":"","status":"pass","suite":"Lexer"},{"actual":"[TokenLexError \"Invalid integer suffix: UU\"]","expected":"[TokenLexError \"Invalid integer suffix: UU\"]","input":"10UU","name":"ошибка: суффикс 10UU","note":"","status":"pass","suite":"Lexer"},{"actual":"[TokenInt,TokenIdentifier \"main\",TokenLeftParen,TokenRightParen,TokenLeftBrace,TokenReturn,TokenNumber 16,TokenSemicolon,TokenRightBrace]","expected":"[TokenInt,TokenIdentifier \"main\",TokenLeftParen,TokenRightParen,TokenLeftBrace,TokenReturn,TokenNumber 16,TokenSemicolon,TokenRightBrace]","input":"int main()\n{\nreturn 0x10;\n}\n","name":"переносы строк","note":"","status":"pass","suite":"Lexer"},{"actual":"[TokenStringLiteral \"line\\n\\\"ok\\\"\"]","expected":"[TokenStringLiteral \"line\\n\\\"ok\\\"\"]","input":"\"line\\n\\\"ok\\\"\"","name":"строковый литерал с escape","note":"","status":"pass","suite":"Lexer"},{"actual":"[TokenCharLiteral '\\n']","expected":"[TokenCharLiteral '\\n']","input":"'\\n'","name":"символьный литерал","note":"","status":"pass","suite":"Lexer"},{"actual":"[TokenLexError \"Unterminated literal\"]","expected":"[TokenLexError \"Unterminated literal\"]","input":"\"abc","name":"незакрытый строковый литерал","note":"","status":"pass","suite":"Lexer"},{"actual":"[TokenLexError \"Invalid char literal: empty\"]","expected":"[TokenLexError \"Invalid char literal: empty\"]","input":"''","name":"пустой char","note":"","status":"pass","suite":"Lexer"},{"actual":"[TokenLexError \"Invalid char literal: expected exactly one character\"]","expected":"[TokenLexError \"Invalid char literal: expected exactly one character\"]","input":"'ab'","name":"многосимвольный char","note":"","status":"pass","suite":"Lexer"},{"actual":"[TokenLexError \"Invalid escape sequence: \\\\q\"]","expected":"[TokenLexError \"Invalid escape sequence: \\\\q\"]","input":"\"\\q\"","name":"невалидный escape","note":"","status":"pass","suite":"Lexer"},{"actual":"[TokenOne,TokenOf,TokenAuto,TokenDouble,TokenInt,TokenStruct,TokenBreak,TokenElse,TokenLong,TokenSwitch,TokenCase,TokenEnum,TokenRegister,TokenTypedef,TokenChar,TokenExtern,TokenReturn,TokenUnion,TokenConst,TokenFloat,TokenShort,TokenUnsigned,TokenContinue,TokenFor,TokenSigned,TokenVoid,TokenDefault,TokenGoto,TokenSizeof,TokenVolatile,TokenDo,TokenIf,TokenStatic,TokenWhile,TokenSfr,TokenSfr16,TokenSbit,TokenSft,TokenBit,TokenData,TokenIdata,TokenBdata,TokenPdata,TokenXdata,TokenCode,TokenInterrupt,TokenUsing,TokenReentrant,TokenAt,TokenIdentifier \"ident\",TokenNumber 42,TokenAssign,TokenEqual,TokenBangEqual,TokenPlus,TokenPlusAssign,TokenPlusPlus,TokenMinus,TokenMinusAssign,TokenMinusMinus,TokenMultiply,TokenMultiplyEqual,TokenDivide,TokenDivideEqual,TokenSemicolon,TokenComma,TokenDot,TokenColon,TokenQuestion,TokenBang,TokenHash,TokenPercent,TokenPercentEqual,TokenAmpersand,TokenAmpersandAmpersand,TokenAmpersandEqual,TokenPipe,TokenPipePipe,TokenPipeEqual,TokenTilde,TokenCaret,TokenCaretEqual,TokenBackslash,TokenStringLiteral \"s\",TokenCharLiteral 'x',TokenLeftParen,TokenRightParen,TokenLeftBrace,TokenRightBrace,TokenLeftBracket,TokenRightBracket,TokenLeftAngle,TokenLessEqual,TokenLessLess,TokenLessLessEqual,TokenRightAngle,TokenGreaterEqual,TokenGreaterGreater,TokenGreaterGreaterEqual]","expected":"[TokenOne,TokenOf,TokenAuto,TokenDouble,TokenInt,TokenStruct,TokenBreak,TokenElse,TokenLong,TokenSwitch,TokenCase,TokenEnum,TokenRegister,TokenTypedef,TokenChar,TokenExtern,TokenReturn,TokenUnion,TokenConst,TokenFloat,TokenShort,TokenUnsigned,TokenContinue,TokenFor,TokenSigned,TokenVoid,TokenDefault,TokenGoto,TokenSizeof,TokenVolatile,TokenDo,TokenIf,TokenStatic,TokenWhile,TokenSfr,TokenSfr16,TokenSbit,TokenSft,TokenBit,TokenData,TokenIdata,TokenBdata,TokenPdata,TokenXdata,TokenCode,TokenInterrupt,TokenUsing,TokenReentrant,TokenAt,TokenIdentifier \"ident\",TokenNumber 42,TokenAssign,TokenEqual,TokenBangEqual,TokenPlus,TokenPlusAssign,TokenPlusPlus,TokenMinus,TokenMinusAssign,TokenMinusMinus,TokenMultiply,TokenMultiplyEqual,TokenDivide,TokenDivideEqual,TokenSemicolon,TokenComma,TokenDot,TokenColon,TokenQuestion,TokenBang,TokenHash,TokenPercent,TokenPercentEqual,TokenAmpersand,TokenAmpersandAmpersand,TokenAmpersandEqual,TokenPipe,TokenPipePipe,TokenPipeEqual,TokenTilde,TokenCaret,TokenCaretEqual,TokenBackslash,TokenStringLiteral \"s\",TokenCharLiteral 'x',TokenLeftParen,TokenRightParen,TokenLeftBrace,TokenRightBrace,TokenLeftBracket,TokenRightBracket,TokenLeftAngle,TokenLessEqual,TokenLessLess,TokenLessLessEqual,TokenRightAngle,TokenGreaterEqual,TokenGreaterGreater,TokenGreaterGreaterEqual]","input":"one of auto double int struct break else long switch case enum register typedef char extern return union const float short unsigned continue for signed void default goto sizeof volatile do if static while sfr sfr16 sbit sft bit data idata bdata pdata xdata code interrupt using reentrant _at_ ident 42 = == != + += ++ - -= -- * *= / /= ; , . : ? ! # % %= & && &= | || |= ~ ^ ^= \\ \"s\" 'x' ( ) { } [ ] < <= << <<= > >= >> >>=","name":"большая строка (all tokens)","note":"","status":"pass","suite":"Lexer"},{"actual":"[TokenIdentifier \"a\"]","expected":"[TokenIdentifier \"a\"]","input":"a","name":"all-tokens: идентификатор a","note":"","status":"pass","suite":"Lexer"},{"actual":"[TokenNumber 42]","expected":"[TokenNumber 42]","input":"42","name":"all-tokens: число 42","note":"","status":"pass","suite":"Lexer"},{"actual":"[TokenIdentifier \"a\"]","expected":"[TokenIdentifier \"a\"]","input":"a","name":"lexerAB: a","note":"","status":"pass","suite":"Lexer"},{"actual":"[TokenIdentifier \"b\"]","expected":"[TokenIdentifier \"b\"]","input":"b","name":"lexerAB: b","note":"","status":"pass","suite":"Lexer"},{"actual":"[TokenIdentifier \"ab\"]","expected":"[TokenIdentifier \"ab\"]","input":"ab","name":"lexerAB: ab","note":"","status":"pass","suite":"Lexer"},{"actual":"[TokenStringLite